<FindbugsPlugin xmlns:xsi="http://www.w3.org/2001/XMLSchema-instance"
          xsi:noNamespaceSchemaLocation="findbugsplugin.xsd"
          pluginid="edu.umd.cs.findbugs.plugins.core"
          version="USE_FINDBUGS_VERSION"
          provider="SpotBugs project" website="https://github.com/spotbugs"
          update-url="http://update.findbugs.org/update-check">

          <!--
  Plugin descriptor for SpotBugs "core" plugin.
  This plugin is enabled by default.
-->
          <Cloud id="edu.umd.cs.findbugs.cloud.doNothingCloud"
                    cloudClass="edu.umd.cs.findbugs.cloud.DoNothingCloud"
                    usernameClass="edu.umd.cs.findbugs.cloud.username.NoNameLookup"/>

          <PluginComponent id="edu.umd.cs.findbugs.bugReporter.SuppressI18N"
                    componentKind="edu.umd.cs.findbugs.bugReporter.BugReporterDecorator"
                    componentClass="edu.umd.cs.findbugs.bugReporter.SuppressionDecorator"
                    disabled="true">
                    <Property key="category">I18N</Property>
          </PluginComponent>
          <PluginComponent id="edu.umd.cs.findbugs.bugReporter.MaxRank14"
                    componentKind="edu.umd.cs.findbugs.bugReporter.BugReporterDecorator"
                    componentClass="edu.umd.cs.findbugs.bugReporter.MaxRankDecorator"
                    disabled="true">
                    <Property key="maxRank">14</Property>
          </PluginComponent>
          <PluginComponent id="edu.umd.cs.findbugs.bugReporter.SelectivelySuppressI18N"
                    componentKind="edu.umd.cs.findbugs.bugReporter.BugReporterDecorator"
                    componentClass="edu.umd.cs.findbugs.bugReporter.SuppressionDecorator"
                    disabled="true">
                    <Property key="category">I18N</Property>
                    <Property key="packageSource">i18n.properties</Property>
          </PluginComponent>
          <PluginComponent id="edu.umd.cs.findbugs.bugReporter.SuppressMultithreaded"
                    componentKind="edu.umd.cs.findbugs.bugReporter.BugReporterDecorator"
                    componentClass="edu.umd.cs.findbugs.bugReporter.SuppressionDecorator"
                    disabled="true">
                    <Property key="category">MT_CORRECTNESS</Property>
          </PluginComponent>
          <PluginComponent id="edu.umd.cs.findbugs.bugReporter.SuppressMalicious"
                    componentKind="edu.umd.cs.findbugs.bugReporter.BugReporterDecorator"
                    componentClass="edu.umd.cs.findbugs.bugReporter.SuppressionDecorator"
                    disabled="true">
                    <Property key="category">MALICIOUS_CODE</Property>
          </PluginComponent>


          <FindBugsMain cmd="addMessages" kind="poweruser" class="edu.umd.cs.findbugs.AddMessages"/>
          <FindBugsMain cmd="analyze" analysis="true" class="edu.umd.cs.findbugs.FindBugs2"/>
          <FindBugsMain cmd="gui" analysis="true" class="edu.umd.cs.findbugs.gui2.Driver"/>
          <FindBugsMain cmd="list" class="edu.umd.cs.findbugs.PrintingBugReporter"/>
          <FindBugsMain cmd="help" class="edu.umd.cs.findbugs.ShowHelp"/>
          <FindBugsMain cmd="version" class="edu.umd.cs.findbugs.Version"/>
          <FindBugsMain cmd="filter" class="edu.umd.cs.findbugs.workflow.Filter"/>
          <FindBugsMain cmd="set" class="edu.umd.cs.findbugs.workflow.SetBugDatabaseInfo"/>

          <FindBugsMain cmd="history" kind="history" class="edu.umd.cs.findbugs.workflow.MineBugHistory"/>
          <FindBugsMain cmd="union" kind="history" class="edu.umd.cs.findbugs.workflow.UnionResults"/>
          <FindBugsMain cmd="merge" kind="history" class="edu.umd.cs.findbugs.workflow.Update"/>

          <FindBugsMain cmd="dis" kind="utility" class="edu.umd.cs.findbugs.visitclass.PrintClass"/>
          <FindBugsMain cmd="errors" class="edu.umd.cs.findbugs.workflow.ListErrors"/>

          <OrderingConstraints>
                    <SplitPass>
                              <Earlier class="edu.umd.cs.findbugs.detect.FieldItemSummary"/>
                              <LaterCategory name="reporting" spanplugins="true"/>
                    </SplitPass>
                    <WithinPass>
                              <Earlier class="edu.umd.cs.findbugs.detect.FieldItemSummary"/>
                              <Later class="edu.umd.cs.findbugs.detect.NoteUnconditionalParamDerefs"
                              />
                    </WithinPass>
                    <WithinPass>
                              <Earlier class="edu.umd.cs.findbugs.detect.FieldItemSummary"/>
                              <Later
                                        class="edu.umd.cs.findbugs.detect.BuildUnconditionalParamDerefDatabase"
                              />
                    </WithinPass>
                    <!--
        NoteSuppressedWarnings should be run in
        an earlier pass than all reporting detectors, including those in
        other plugins.
    -->
                    <SplitPass>
                              <Earlier class="edu.umd.cs.findbugs.detect.NoteSuppressedWarnings"/>
                              <LaterCategory name="reporting" spanplugins="true"/>
                    </SplitPass>
                    <SplitPass>
                              <Earlier class="edu.umd.cs.findbugs.detect.OverridingEqualsNotSymmetrical"/>
                              <Later class="edu.umd.cs.findbugs.detect.FindHEmismatch"/>
                    </SplitPass>
                    <SplitPass>
                              <Earlier class="edu.umd.cs.findbugs.detect.FunctionsThatMightBeMistakenForProcedures"/>
                              <Later class="edu.umd.cs.findbugs.detect.MethodReturnCheck"/>
                    </SplitPass>
                    <WithinPass>
                              <Earlier class="edu.umd.cs.findbugs.detect.FindBugsSummaryStats"/>
                              <Later
                                        class="edu.umd.cs.findbugs.detect.EqualsOperandShouldHaveClassCompatibleWithThis"
                              />
                    </WithinPass>
                    <WithinPass>
                              <Earlier class="edu.umd.cs.findbugs.detect.FindBugsSummaryStats"/>
                              <Later class="edu.umd.cs.findbugs.detect.OverridingEqualsNotSymmetrical" />
                    </WithinPass>
                    <WithinPass>
                              <Earlier class="edu.umd.cs.findbugs.detect.NoteSuppressedWarnings"/>
                              <Later
                                        class="edu.umd.cs.findbugs.detect.EqualsOperandShouldHaveClassCompatibleWithThis"
                              />
                    </WithinPass>
                    <WithinPass>
                              <Earlier class="edu.umd.cs.findbugs.detect.NoteSuppressedWarnings"/>
                              <Later
                                        class="edu.umd.cs.findbugs.detect.OverridingEqualsNotSymmetrical"
                              />
                    </WithinPass>
                    <SplitPass>
                              <Earlier class="edu.umd.cs.findbugs.detect.NoteSuppressedWarnings"/>
                              <Later
                                        class="edu.umd.cs.findbugs.detect.FindUnrelatedTypesInGenericContainer"
                              />
                    </SplitPass>
                    <SplitPass>
                              <Earlier
                                        class="edu.umd.cs.findbugs.detect.EqualsOperandShouldHaveClassCompatibleWithThis"/>
                              <Later class="edu.umd.cs.findbugs.detect.FindRefComparison"/>
                    </SplitPass>
                    <SplitPass>
                              <Earlier
                                        class="edu.umd.cs.findbugs.detect.EqualsOperandShouldHaveClassCompatibleWithThis"/>
                              <Later
                                        class="edu.umd.cs.findbugs.detect.FindUnrelatedTypesInGenericContainer"
                              />
                    </SplitPass>
                    <SplitPass>
                              <Earlier class="edu.umd.cs.findbugs.detect.NoteSuppressedWarnings"/>
                              <Later class="edu.umd.cs.findbugs.detect.FindRefComparison"/>
                    </SplitPass>

                    <SplitPass>
                              <Earlier class="edu.umd.cs.findbugs.detect.NoteAnnotationRetention"/>
                              <Later class="edu.umd.cs.findbugs.detect.DumbMethods"/>
                    </SplitPass>
                    <SplitPass>
                              <Earlier
                                        class="edu.umd.cs.findbugs.detect.NoteDirectlyRelevantTypeQualifiers"/>
                              <Later class="edu.umd.cs.findbugs.detect.CheckTypeQualifiers"/>
                    </SplitPass>
                    <SplitPass>
                              <Earlier
                                        class="edu.umd.cs.findbugs.detect.BuildObligationPolicyDatabase"/>
                              <Later class="edu.umd.cs.findbugs.detect.FindUnsatisfiedObligation"/>
                    </SplitPass>


                    <SplitPass>
                              <Earlier class="edu.umd.cs.findbugs.detect.ReflectiveClasses"/>
                              <Later class="edu.umd.cs.findbugs.detect.UnreadFields"/>
                    </SplitPass>
                    <SplitPass>
                              <Earlier class="edu.umd.cs.findbugs.detect.ExplicitSerialization"/>
                              <Later class="edu.umd.cs.findbugs.detect.SerializationIdiom"/>
                    </SplitPass>
                    <SplitPass>
                              <Earlier class="edu.umd.cs.findbugs.detect.CalledMethods"/>
                              <Later